{
  "frame": "U",
  "units": "mm",
  "implants": {
    "1": {
      "centroid_mm": [15.0, 10.0, 20.0],
      "axis_vector": [0.0, 0.0, 1.0],
      "marker_id": 100,
      "reprojection_error_px": 0.45
    },
    "2": {
      "centroid_mm": [-5.0, 13.0, 19.5],
      "axis_vector": [0.05, 0.0, 0.998],
      "marker_id": 101,
      "reprojection_error_px": 0.52
    },
    "3": {
      "centroid_mm": [30.0, -5.0, 21.0],
      "axis_vector": [-0.03, 0.02, 0.999],
      "marker_id": 102,
      "reprojection_error_px": 0.38
    },
    "4": {
      "centroid_mm": [-20.0, -3.0, 19.8],
      "axis_vector": [0.02, -0.01, 0.999],
      "marker_id": 103,
      "reprojection_error_px": 0.61
    }
  },
  "metadata": {
    "timestamp": "2026-01-14T09:30:00Z",
    "source": "photogrammetry",
    "n_implants": 4,
    "mean_reprojection_error_px": 0.49,
    "reconstruction_run": "test/fixtures/mock_ios_data",
    "tag_size_mm": 8.8,
    "notes": "Mock test data - transformed from test_implants_I.json with known T_U_from_I"
  }
}
